{
  "dcp_version": "2.0",
  "declaration_id": "advisory:high-cost-action-2026-008",
  "session_nonce": "a1b2c3d4e5f6a1b2c3d4e5f6a1b2c3d4e5f6a1b2c3d4e5f6a1b2c3d4e5f6a1b2",
  "agent_id": "agent:research-bot-v2-001",
  "human_id": "human:alice-abc-123",
  "significance_score": 780,
  "action_summary": "Agent proposes purchasing a $2,400 annual subscription to the Nature Research Database to improve literature coverage from 72% to an estimated 95% of relevant publications.",
  "recommended_response": "Review the cost-benefit analysis attached as evidence hash and approve or suggest an alternative data source",
  "response_deadline": "2026-03-12T09:00:00Z",
  "human_response": null,
  "proceeded_without_response": false,
  "timestamp": "2026-03-10T15:00:00Z",
  "composite_sig": {
    "classical": { "alg": "ed25519", "kid": "a1b2c3d4e5f6a1b2c3d4e5f6a1b2c3d4", "sig_b64": "dGVzdHNpZzEyMzQ1Njc4OTAxMjM0NTY=" },
    "pq": { "alg": "ml-dsa-65", "kid": "d4e5f6a1b2c3d4e5f6a1b2c3d4e5f6a1", "sig_b64": "dGVzdHBxc2lnMTIzNDU2Nzg5MDEyMzQ1Ng==" },
    "binding": "pq_over_classical"
  }
}
